{
  "$schema": "http://json-schema.org/draft-07/schema#",
  "$id": "https://judokon.dev/schemas/aesopsMeta.schema.json",
  "type": "array",
  "items": {
    "type": "object",
    "properties": {
      "id": {
        "type": "integer",
        "description": "Unique identifier for the fable."
      },
      "title": {
        "type": "string",
        "description": "Title of the fable."
      },
      "tags": {
        "type": "array",
        "items": { "type": "string" }
      },
      "readingTime": { "type": "string" },
      "moral": { "type": "string" },
      "haiku": { "type": "string" }
    },
    "required": ["id", "title", "tags", "readingTime", "moral", "haiku"],
    "additionalProperties": false
  }
}
