[
  {
    "id": 1,
    "title": "The Wind and the Sun",
    "tags": ["strength", "gentleness", "competition", "nature", "wisdom"],
    "readingTime": "5 minutes",
    "moral": "Gentleness and kindness can achieve what force and aggression cannot.",
    "haiku": "Warm rays melt the chill\\nStrength in calm, not stormy gusts\\nCloak falls in still peace."
  },
  {
    "id": 2,
    "title": "The Fox and the Crow",
    "tags": ["flattery", "deception", "pride", "cleverness", "trust"],
    "readingTime": "6 minutes",
    "moral": "Beware of those who flatter you only to get what they want.",
    "haiku": "Fox with hungry grin\\nPraise lifts pride, and cheese falls down\\nTruth hides in sweet words."
  },
  {
    "id": 3,
    "title": "The Donkey and His Shadow",
    "tags": ["greed", "foolishness", "conflict", "priorities", "humility"],
    "readingTime": "7 minutes",
    "moral": "Arguing over trivial matters can cause you to lose what truly matters.",
    "haiku": "Shadow in the sun\\nQuarrel steals the path ahead\\nDonkey walks alone."
  },
  {
    "id": 4,
    "title": "The Donkey in the Lion's Skin",
    "tags": ["deception", "identity", "respect", "truth", "self-acceptance"],
    "readingTime": "6 minutes",
    "moral": "Pretending to be something you're not may fool others briefly, but the truth always reveals itself.",
    "haiku": "In lion’s costume\\nDonkey brays and truth is known\\nBe true to yourself."
  },
  {
    "id": 5,
    "title": "The Crow and the Raven",
    "tags": ["identity", "envy", "self-worth", "authenticity", "acceptance"],
    "readingTime": "7 minutes",
    "moral": "True admiration comes from being yourself, not from pretending to be someone else.",
    "haiku": "Feathers not your own\\nWon’t bring the praise you long for\\nShine in your own light."
  },
  {
    "id": 6,
    "title": "The Bundle of Sticks",
    "tags": ["unity", "family", "strength", "cooperation", "wisdom"],
    "readingTime": "7 minutes",
    "moral": "Unity is strength; when people stand together, they cannot be broken.",
    "haiku": "Sticks bound, firm and strong\\nAlone they snap one by one\\nTogether, they hold."
  },
  {
    "id": 7,
    "title": "The Wolf and the Crane",
    "tags": ["ingratitude", "trust", "danger", "helpfulness", "caution"],
    "readingTime": "6 minutes",
    "moral": "Helping the ungrateful can lead to danger and disappointment.",
    "haiku": "Crane pulled out the bone\\nWolf's thanks came with biting teeth\\nAid earns no reward."
  },
  {
    "id": 8,
    "title": "The Hawk and the Nightingale",
    "tags": ["wisdom", "survival", "value", "patience", "mercy"],
    "readingTime": "7 minutes",
    "moral": "Words and wisdom can be more powerful than strength in moments of danger.",
    "haiku": "Nightingale pleads, sings\\nHawk trades hunger for her voice\\nMercy earns a song."
  },
  {
    "id": 9,
    "title": "The Lion and the Boar",
    "tags": ["conflict", "wisdom", "restraint", "coexistence", "pride"],
    "readingTime": "8 minutes",
    "moral": "Choosing peace over pride can prevent unnecessary harm and lead to mutual respect.",
    "haiku": "Two beasts face to fight\\nVultures watch from skies above\\nPeace drinks, pride steps back."
  },
  {
    "id": 10,
    "title": "The Fox and the Goat",
    "tags": ["cunning", "trust", "deception", "foresight", "naivety"],
    "readingTime": "6 minutes",
    "moral": "Always think ahead and be cautious about whose advice you follow.",
    "haiku": "Fox with clever scheme\\nGoat leaps in, trust seals his fate\\nPlan before you leap."
  },
  {
    "id": 11,
    "title": "The Travelers and the Plane Tree",
    "tags": ["gratitude", "judgment", "value", "nature", "humility"],
    "readingTime": "6 minutes",
    "moral": "True worth is not always visible at first glance; even simple things can provide great value.",
    "haiku": "Shaded from the sun\\nComplaints blind to present gifts\\nStillness speaks of worth."
  },
  {
    "id": 12,
    "title": "The Two Pots",
    "tags": ["friendship", "respect", "difference", "empathy", "boundaries"],
    "readingTime": "7 minutes",
    "moral": "True friendship respects each other's strengths and limitations.",
    "haiku": "Brass and clay afloat\\nRiver tests their fragile bond\\nKindness leads them home."
  },
  {
    "id": 13,
    "title": "The Dog and the Bone",
    "tags": ["greed", "contentment", "reflection", "loss", "lesson"],
    "readingTime": "5 minutes",
    "moral": "Greed can lead to losing what you already have.",
    "haiku": "Bone clutched in his jaws\\nGreedy bark, a splash below\\nAll for naught, it's gone."
  },
  {
    "id": 14,
    "title": "The Fisherman and the Little Fish",
    "tags": ["contentment", "pragmatism", "value", "expectation", "decision"],
    "readingTime": "6 minutes",
    "moral": "A small gain today is better than a big promise tomorrow.",
    "haiku": "Tiny fish pleads hope\\nBut the sea won’t promise back\\nSure catch feeds today."
  },
  {
    "id": 15,
    "title": "The Bull and the Frog",
    "tags": ["pride", "contentment", "comparison", "identity", "humility"],
    "readingTime": "6 minutes",
    "moral": "Trying to be something you're not can lead to foolishness and harm.",
    "haiku": "Bull's size spurs a puff\\nFrog stretches past his limit\\nBurst pride, lesson learned."
  },
  {
    "id": 16,
    "title": "The Oak and the Reeds",
    "tags": ["flexibility", "pride", "humility", "strength", "adaptability"],
    "readingTime": "7 minutes",
    "moral": "True strength lies in adaptability and humility, not just in standing firm.",
    "haiku": "Storm shakes forest still\\nOak resists and breaks apart\\nReeds bow, rise again."
  },
  {
    "id": 17,
    "title": "The Miser and the Gold",
    "tags": ["greed", "wealth", "value", "contentment", "sharing"],
    "readingTime": "7 minutes",
    "moral": "Wealth is meaningless if it's never used or shared.",
    "haiku": "Gold buried in ground\\nNever touched, then stolen fast\\nEmpty riches lost."
  },
  {
    "id": 18,
    "title": "The Fox and the Monkey",
    "tags": ["leadership", "humility", "wisdom", "deception", "pride"],
    "readingTime": "8 minutes",
    "moral": "True leadership is earned through wisdom and integrity, not through boasting and show.",
    "haiku": "Monkey boasts of might\\nFalls short chasing empty praise\\nFox shows truth with grace."
  },
  {
    "id": 19,
    "title": "The Fox and the Hedgehog",
    "tags": ["wisdom", "simplicity", "cleverness", "defense", "humility"],
    "readingTime": "8 minutes",
    "moral": "Sometimes, one reliable strategy is better than many clever tricks.",
    "haiku": "Fox with tricks galore\\nHedgehog curls with quiet strength\\nSafe in spiky calm."
  },
  {
    "id": 20,
    "title": "The Lion and the Dolphin",
    "tags": ["friendship", "cooperation", "limitations", "understanding", "respect"],
    "readingTime": "6 minutes",
    "moral": "True alliances are founded on understanding and respecting each other's unique strengths and limitations.",
    "haiku": "Lion on the shore\\nDolphin dances in the waves\\nEach realm has its bounds."
  },
  {
    "id": 21,
    "title": "The Fisher and the Snake",
    "tags": ["trust", "kindness", "caution", "nature", "wisdom"],
    "readingTime": "6 minutes",
    "moral": "Kindness is noble, but it must be tempered with wisdom, as not all creatures can change their nature.",
    "haiku": "A snake in the net\\nSaved by hands both kind and brave\\nStill, it struck again."
  },
  {
    "id": 22,
    "title": "The Eagle and the Beetle",
    "tags": ["respect", "humility", "courage", "cleverness", "justice"],
    "readingTime": "7 minutes",
    "moral": "Even the smallest creature can teach a powerful lesson when respect is lacking.",
    "haiku": "Small beetle stands tall\\nStrength bows to clever wisdom\\nRespect conquers pride."
  },
  {
    "id": 23,
    "title": "The Old Woman and the Doctor",
    "tags": ["greed", "honesty", "justice", "betrayal", "cunning"],
    "readingTime": "6 minutes",
    "moral": "Greed and dishonesty will ultimately be exposed and lead to disgrace.",
    "haiku": "Eyes blinded by trust\\nTruth returns with clearer sight\\nGreed unmasked by light."
  },
  {
    "id": 24,
    "title": "The Gnat and the Bull",
    "tags": ["humility", "self-importance", "perspective", "ego", "insignificance"],
    "readingTime": "5 minutes",
    "moral": "True importance lies in one’s actions, not in seeking attention or validation.",
    "haiku": "Buzzing on the horn\\nGnat seeks praise the bull won't give\\nSize means not respect."
  },
  {
    "id": 25,
    "title": "The Donkey and His Masters",
    "tags": ["contentment", "gratitude", "perspective", "discontent", "expectation"],
    "readingTime": "7 minutes",
    "moral": "Wishing for change without appreciating the present can lead to worse outcomes.",
    "haiku": "From one load to next\\nDonkey longs for kinder hands\\nLearns to bear his lot."
  },
  {
    "id": 26,
    "title": "The Wolf and the Kid",
    "tags": ["obedience", "cleverness", "danger", "family", "caution"],
    "readingTime": "7 minutes",
    "moral": "Listening to wise advice can prevent trouble that cleverness alone might not overcome.",
    "haiku": "A kid strays too far\\nWolf’s fangs near—but wit and calls\\nBring the herd to save."
  },
  {
    "id": 27,
    "title": "The Ant and the Chrysalis",
    "tags": ["judgment", "transformation", "patience", "perspective", "growth"],
    "readingTime": "6 minutes",
    "moral": "Don't judge others by appearances; growth often happens quietly and unseen.",
    "haiku": "Stillness hides the change\\nWings unfold from quiet strength\\nNow she soars with grace."
  },
  {
    "id": 28,
    "title": "The Oak and the Vine",
    "tags": ["cooperation", "mutual support", "strength", "growth", "respect"],
    "readingTime": "7 minutes",
    "moral": "True strength comes from supporting each other, even when our strengths are different.",